{
  "schemaVersion": "0.1",
  "mode": "blocks",
  "meta": {
    "name": "Square walker",
    "createdAt": "2026-10-10T09:00:00Z",
    "updatedAt": "2026-10-10T09:00:00Z",
    "appVersion": "0.0.1"
  },
  "blocks": {
    "stage": {
      "logicalWidth": 480,
      "logicalHeight": 360,
      "displayPreset": "480x360",
      "backdrops": [
        {
          "id": "bg1",
          "name": "Meadow",
          "type": "image",
          "source": "builtin:meadow"
        }
      ]
    },
    "sprites": [
      {
        "id": "cat",
        "name": "Cat",
        "x": 0,
        "y": 0,
        "direction": 90,
        "size": 100,
        "visible": true,
        "costumes": [
          {
            "id": "cat-a",
            "name": "cat-a",
            "type": "vector",
            "source": "builtin:cat",
            "rotationCenterX": 50,
            "rotationCenterY": 50
          }
        ],
        "currentCostume": 0,
        "variables": [
          {
            "id": "steps",
            "name": "steps",
            "value": 0
          }
        ],
        "scripts": [
          {
            "id": "s1",
            "x": 40,
            "y": 40,
            "blocks": [
              {
                "type": "event_flag"
              },
              {
                "type": "control_repeat",
                "fields": {
                  "TIMES": 4
                }
              }
            ]
          }
        ]
      }
    ]
  }
}
